{
  "$schema": "https://your-org.com/schemas/component-manifest-v1.json",
  "id": "canary.status-badge",
  "status": "stable",

  "code": {
    "package": "@harnessio/ui",
    "export": "StatusBadge",
    "import": "import { StatusBadge } from '@harnessio/ui/components'",
    "path": "packages/ui/src/components/status-badge/status-badge.tsx"
  },

  "figma": {
    "library": "HDS | Components 3.0",
    "fileKey": "AIgjIyUzcuZzuVnuoOyhQE",
    "name": "StatusBadge",
    "exampleNodeId": "1293:5995",
    "codeConnect": "packages/ui/src/components/status-badge/status-badge.figma.ts",
    "componentSetKey": "b115d5f844f94a65ee1ab379e75cd382baea256c",
    "variantPropertyMap": {
      "variant": "variant",
      "theme": "theme",
      "size": "size"
    },
    "publishStatus": "published",
    "enforceSync": true
  },

  "purpose": {
    "summary": "Display a status indicator with a semantic theme (muted, success, warning, danger, info, merged, risk) and optional pulse animation on the 'status' variant",
    "useWhen": [
      "Communicating the state of a system, process, or entity (active, pending, error, warning)",
      "Labeling a status alongside other metadata in tables, lists, or cards",
      "Showing pulse animation for real-time status (e.g., 'currently processing')"
    ],
    "doNotUseWhen": [
      "Showing count badges (use CounterBadge instead)",
      "Displaying actionable tags or filters (use Tag component)",
      "Showing progress or completion percentage (use Progress component)"
    ]
  },

  "props": {
    "shared": [
      {
        "name": "variant",
        "type": "enum",
        "values": ["primary", "secondary", "outline", "ghost", "status"],
        "default": "outline",
        "codeNote": "Component style variant. Defaults to 'outline' when omitted; pass another only when the design calls for it. 'status' (dot plus label) is the only variant that takes pulse, and the only one that cannot take an icon."
      },
      {
        "name": "theme",
        "type": "enum",
        "values": ["muted", "success", "warning", "danger", "info", "merged", "risk"],
        "default": "muted",
        "codeNote": "Semantic color theme indicating the status type"
      },
      {
        "name": "size",
        "type": "enum",
        "values": ["sm", "md"],
        "default": "md",
        "codeNote": "Badge size"
      },
      {
        "name": "children",
        "type": "node",
        "default": null,
        "codeNote": "Badge label/text content",
        "figmaNote": "Exposed in Figma as the TEXT property 'textString#1299:25'. Figma holds plain text only; the code prop accepts any ReactNode."
      }
    ],
    "designOnly": [],
    "codeOnly": [
      {
        "name": "icon",
        "type": "string",
        "trigger": "appearance-override",
        "neverWhen": { "variant": ["status"] },
        "notes": "Optional IconV2 name (a key of IconNameMapV2). Figma does expose icon controls ('viewIcon#1293:13' plus the instance swap '↳ icon#1299:52'), but those select an icon *instance* while this prop takes an icon *name*, and the icon component set has no Code Connect mapping to recover a name from. Agents must supply the name explicitly."
      },
      {
        "name": "pulse",
        "type": "boolean",
        "trigger": "appearance-override",
        "onlyWhen": { "variant": ["status"] },
        "notes": "Animates the status indicator dot (CSS animate-pulse). Requires variant='status'; the discriminated union types it as never on every other variant. No Figma property corresponds to it, though the Figma component does draw the indicator dot."
      },
      {
        "name": "className",
        "type": "string",
        "trigger": "appearance-override",
        "notes": "Additional CSS classes (Tailwind); should not override token-based styling"
      }
    ]
  },

  "tokens": {
    "rootClass": "cn-badge",
    "rule": "semantic-only",
    "refs": {
      "variant.primary": "badge.variant.primary",
      "variant.secondary": "badge.variant.secondary",
      "variant.outline": "badge.variant.outline",
      "variant.ghost": "badge.variant.ghost",
      "variant.status": "badge.variant.status",
      "theme.muted": "badge.theme.muted",
      "theme.success": "badge.theme.success",
      "theme.warning": "badge.theme.warning",
      "theme.danger": "badge.theme.danger",
      "theme.info": "badge.theme.info",
      "theme.merged": "badge.theme.merged",
      "theme.risk": "badge.theme.risk",
      "size.sm": "badge.size.sm",
      "size.md": "badge.size.md",
      "animation.pulse": "animation.pulse"
    }
  },

  "accessibility": {
    "notes": "Badge is a passive status indicator; not interactive. It renders a plain div with no ARIA role, so it is not a live region and changes are not announced. Text is the only carrier of meaning. Icon (if present) should be decorative (aria-hidden)."
  },

  "states": [
    {
      "name": "base",
      "triggeredBy": {
        "source": "interaction",
        "ref": "none"
      },
      "description": "Default badge appearance"
    },
    {
      "name": "pulse",
      "triggeredBy": {
        "source": "prop",
        "ref": "pulse"
      },
      "description": "Animated pulse on status indicator dot (variant='status' only)"
    }
  ],

  "governance": {
    "rulesDocs": [
      "docs/system/accessibility.md",
      "docs/system/color-system.md",
      "docs/system/interaction-states.md",
      "docs/system/visual-primitives.md",
      "docs/system/typography.md",
      "docs/system/spacing.md",
      "docs/system/shadows.md",
      "docs/system/component-architecture.md",
      "docs/system/design-to-code-flow.md",
      "schemas/status-badge.md"
    ],
    "tokenStatus": "All theme and animation color refs recorded and verified; size tokens pending audit"
  },

  "knownGaps": ["No built-in close/dismiss action (use wrapper component if needed)"],

  "examples": {
    "correct": [
      "<StatusBadge variant='status' theme='success' pulse>Active</StatusBadge>",
      "<StatusBadge theme='warning' icon='warning-circle'>Attention needed</StatusBadge>",
      "<StatusBadge variant='secondary' theme='muted'>Draft</StatusBadge>"
    ],
    "incorrect": [
      "<StatusBadge variant='outline' pulse>Pulse is only allowed on variant='status' (rejected by the type)</StatusBadge>",
      "<StatusBadge onClick={() => {}}>Status badges are not interactive</StatusBadge>"
    ]
  }
}
